{"$schema":"https://json-schema.org/draft/2020-12/schema","type":"object","required":["schema_version","packet_id","title","canonical_inputs","summary","evidence","tests","audit"],"properties":{"schema_version":{"const":"1.0"},"packet_id":{"type":"string","minLength":1},"title":{"type":"string"},"canonical_inputs":{"type":"array","minItems":1},"summary":{"type":"object"},"findings":{"type":"array"},"evidence":{"type":"array"},"tests":{"type":"array"},"changes":{"type":"array"},"unresolved":{"type":"array"},"human_decisions":{"type":"array"},"audit":{"type":"object","required":["mode","checks","limitations"],"properties":{"mode":{"enum":["parallel-subagents","sequential-single-agent"]}}}},"additionalProperties":true}
