{"schema_version":"1.0","packet_id":"RP-001","title":"Evidence <test>","canonical_inputs":[{"kind":"markdown","ref":"reports/source.md","sha256":"abc"}],"summary":{"status":"conditional","conclusion":"Keep quotes & citations"},"findings":[{"id":"F-001","priority":"P0","status":"warning","title":"Evidence gap","claim":"A <tag> remains escaped","evidence_ids":["E-001"]},{"id":"F-002","priority":"P1","status":"blocked","title":"Work unverified","claim":"Needs live run","evidence_ids":["E-002"]}],"evidence":[{"id":"E-001","kind":"quote","locator":"https://example.test/p4","excerpt":"Original quote\n\n日本語訳","verification":"verified","notes":"[source (2026/09), p.4]"},{"id":"E-002","kind":"inference","locator":"work-cloud://not-run","verification":"unverified"}],"tests":[{"id":"T-001","name":"Markdown","status":"pass","command":"python tests/run_tests.py","evidence_ids":["E-001"]}],"unresolved":[{"id":"U-001","question":"Work Cloud?","owner":"user","blocking":false}],"human_decisions":[{"id":"D-001","question":"Publish?","options":["yes","no"],"status":"required"}],"audit":{"mode":"sequential-single-agent","checks":["structure","evidence","HTML"],"limitations":["parallel agents hit usage limit","Work not run"]}}
